{
  "id": "age-over-18-sd-jwt",
  "format": "dc+sd-jwt",
  "display": "Proof of Age (18+)",
  "scope": "age",
  "vct": "https://credentials.idpartners.example/age-over-18/1",
  "rationale": "The SD-JWT encoding of the same single-purpose age credential. Note portrait is a data URL here and a bstr in the mdoc encoding - the same attribute, two wire shapes, which is the whole reason encoding is per-claim configuration rather than inferred from the name.",
  "claims": [
    {
      "name": "age_over_18",
      "encoding": "bool"
    },
    {
      "name": "given_name"
    },
    {
      "name": "family_name"
    },
    {
      "name": "portrait",
      "encoding": "data-url"
    },
    {
      "name": "expiry_date",
      "encoding": "full-date"
    },
    {
      "name": "issuing_authority"
    }
  ]
}
